"pro src","item-gallery src","item-gallery src 2","map-content src","logo-branding src","item-link","item-price","item-detail","item-detail 2","item-detail 3","ellipsis","item-parking","listing-tags"
"","","","","https://st3.idealista.pt/4e/0c/01/zome-odivelas.gif","T2 flat in rua Augusto da Cunha Lamas, 6, Colinas do Cruzeiro, Odivelas","349,000","T2","105 m²","6th floor with lift","Identificação do imóvel: ZMPT561721
When we find ourselves on the journey of searching for the ideal home, the main factor is location. And this one couldn't be better! It is located in one of the most renowned urbanizations in Odivelas, Colinas do Cruzeiro.
Designed for families who appreciate well-being and a uniqu","","Bright"
"","","","","https://st3.idealista.pt/4b/f5/86/remax-yes.gif","T3 flat in praceta José Figueiredo Fonseca, Carcavelos Centro, Carcavelos e Parede","760,000","T3","130 m²","1st floor with lift","APARTMENT | T3 | CARCAVELOS | WALL
Apartment, with excellent sun exposure, located in one of the most desired areas of Carcavelos and Parede, Quinta das Marianas.
This charming property offers a luxurious and contemporary lifestyle.
The kitchen is equipped with a ceramic hob, oven, extractor fan, microwave, washing","Parking included",""
"","","","","https://st3.idealista.pt/4d/24/a2/quintela-e-penalva.gif","T3 flat in rua dos Lusíadas, Largo do Calvário - Lx Factory, Alcântara","820,000","T3","176 m²","2nd floor without lift","3+1-bedroom apartment in Alcântara, close to LX Factory, the Avé Maria School, the Instituto Superior de Agronomia, the Monsanto National Park and all shops, services and transport.
This property, with 176 sq m of gross private area, rehabilitated in 2006 within a building without a lift, consists of a hall (6 sq m),","",""
"","","","","https://st3.idealista.pt/4e/0c/01/zome-odivelas.gif","Semi-detached house in rua do Sol, Nn, Sobreiro Curvo, a dos Cunhados e Maceira","485,000","T3","329 m²","","Identificação do imóvel: ZMPT565094
Welcome to this modern villa, an oasis of comfort and elegance in Santa Cruz, less than 2 km from the stunning beach. This single-story (Unit A), 3-bedroom house is an architectural marvel that perfectly combines modernity with the surrounding nature, creating a unique and welcoming","Parking included","Bright"
"","","","","https://st3.idealista.pt/4b/f5/86/remax-yes.gif","Detached house in rua das Tilias, Jardins da Parede, Carcavelos e Parede","1,320,000","T4","216 m²","","House with sea view in a very quiet residential area, close to shops and services, just 8 minutes walk from the beach of S. João do Estoril.
The villa has two floors, on the ground floor is the social area of the house with a large living room with two distinct areas and direct access to the garden. Fully equipped kit","Parking included","Sea views"
"","","","","","","","","","","","",""
"","","","","https://st3.idealista.pt/5d/85/10/lane-exclusive-real-estate.gif","Detached house in rua Alecrim, Areia - Birre, Cascais, Cascais e Estoril","2,800,000","T4","496 m²","","Excellent 4 bedroom villa of contemporary architecture, in the center of Birre.
With 3 floors it is composed as follows:
Floor 0
- Entrance hall
- Living room with 50sqm, with access to the garden and swimming pool
- Social toilet
- Fully equipped kitchen open to the living room
- 1 Suite
Floor 1
- 3 En-suite bedroo","Parking included","Luxury"
"","","","","https://st3.idealista.pt/e5/8d/1a/engel-volkers-lisboa.gif","T1 flat in rua da Paz, Príncipe Real - São Bento, Misericórdia","525,000","T1","58 m²","1st floor without lift","Close to Praça das Flores, a beautiful and historic square in Lisbon, is this fully renovated flat, designed by an Italian architect.
This one-bedroom flat features an open-plan living room and kitchen, a bedroom with walk-in wardrobe, and an en-suite bathroom.
The flat is filled with natural light and features contemp","","Bright"
"","","","","https://st3.idealista.pt/e5/8d/1a/engel-volkers-lisboa.gif","T1 flat in rua Cidade da Horta, Estefânia, São Jorge de Arroios, Arroios","315,000","T1","69 m²","","Two-bedroom apartment of 69sqm located in the Ilhas neighborhood, a privileged residential area of Estefânia.
It's a charming apartment that retains its old style and has a ceiling height of 3.20m. It retains the original floorboards, which have been honed and varnished and are in perfect condition.
It comprises a livi","",""
"","","","","https://st3.idealista.pt/b4/f6/7d/century-21-rodolfo-natario.gif","Penthouse in rua Mateus Fernandes, Moinho das Antas, Oeiras e São Julião da Barra - Paço de Arcos - Caxias","845,000","T3","151 m²","8th floor with lift","Come and discover this penthouse in the Moinho das Antas area, with an 80 m2 terrace, garage space and a 10-minute walk from the beach.
Its wonderful view goes from the Tagus River with the Cristo Rei to Cascais and Cabo Espichel. However, I cannot hide from you the difficult dilemma that you will have to solve: will","Parking included",""
"","","","","https://st3.idealista.pt/3d/dd/5b/dohler-homes-real-estate.gif","T2 flat in rua Angelina Vidal, Centro, Penha de França","299,900","T2","51 m²","2nd floor without lift","2 bedroom apartment with 51m2 to recover, inserted in a second floor of a building in good condition and without elevator. With an excellent location, this apartment is located on Angelina Vidal Street, surrounded by commerce, schools, pharmacies, banks, transport, 5 minutes walk from the Intendente metro and 400 m fro","",""
"","","","","https://st3.idealista.pt/58/da/0d/nestenn-portugal.gif","Detached house in estrada do Porto Dinheiro, Ribamar, Lourinhã","595,000","T3","162 m²","","Inserted in a plot of 700 m2 and with an unobstructed view of the sea, we find this 3 bedroom villa of modern design in the Lourinhã area.
3 bedroom villa in the finishing phase was all designed and structured respecting high standards of quality of materials, finishes and insulation in order to provide greater comfor","",""
"","","","","https://st3.idealista.pt/17/c0/ba/zome-amadora.gif","Detached house in rua Camacho Costa, 721, Pontinha e Famões, Odivelas","669,500","T5","378 m²","","Identificação do imóvel: ZMPT565232
NEW IN FAMÕES - ODIVELAS!
Explore this 5-bedroom house in Famões.
Built in 2023 in a growing residential area, the property combines contemporary design with community convenience.
Key Features:
- Spacious Living: Four well-designed bedrooms offer a balanced blend of style and","Parking included",""
"","","","","https://st3.idealista.pt/5d/85/10/lane-exclusive-real-estate.gif","Detached house, Birre, Areia - Birre, Cascais, Cascais e Estoril","5,100,000","T6","1,115 m²","","This magnificent 6 bedroom villa, located in a prime residential area, is held in a contemporary style with very high end specifications and comprises of:
A large living room leading to an open space dinning room with a modern kitchen with top range appliances, a guest suite and a guest wc on the ground floor.
4 en-su","Parking included","Luxury"
"","","","","https://st3.idealista.pt/77/7d/1c/draft-in-homes.gif","T6 flat in rua dos Sobreiros, 259, Costa da Guia, Cascais, Cascais e Estoril","1,600,000","T6","259 m²","with lift","8-room flat in Costa Da Guia
6 bedroom duplex flat in a private condominium.
On the ground floor, the property comprises a spacious entrance hall, kitchen, living room with a balcony overlooking the sea, dining room, 1 suite, 1 full bathroom and a bedroom.
On the upper floor we have a living room connected to a games","Parking included","Sea views"
"","","","","https://st3.idealista.pt/0a/cb/c1/west-life-imobiliaria.gif","T3 flat in Ericeira Sul, Ericeira","395,000","T3","127 m²","3rd floor with lift","EXCLUSIVE WL - Excellent 3 bedroom flat inserted in a gated community, very family-friendly, with garden areas, a desirable swimming pool and barbecue, just 5 minutes from some of the most beautiful beaches in the country.
The property is located on a second floor, with a lift. Endowed with an unobstructed view, it ha","Parking included",""
"","","","","https://st3.idealista.pt/cd/1b/57/valor-de-mercado-mediacao-imobiliaria.gif","T3 flat in avenida Salgado Zenha, Nn, Santo António dos Cavaleiros e Frielas, Loures","347,000","T3","140 m²","7th floor with lift","Opportunity to acquire this 3 bedroom apartment with a total area of 120 square meters, located in Santo António de Cavaleiros, Loures, district of Lisbon. Property in good condition and with good sun exposure, is located on the 7th floor in a building with elevator. The property consists of a welcoming entrance hall,","Parking included",""
"","","","","https://st3.idealista.pt/ed/c2/fc/porta-da-frente-christies-international-real-estate.gif","T1 flat in Praça da Alegria, Santo António","795,000","T1","72 m²","","1 bedroom apartment, in Avenida da Liberdade, with 1 parking space and 1 storage area, in an iconic building fully rehabilitated. It is rented until June 2025.
This apartment, of modern lines and the highest quality finishes, is the ideal apartment for those who intend to live in the most sought after avenue of the ci","",""
"","","","","","","","","","","","",""
"","","","","https://st3.idealista.pt/38/c3/71/cbluxus.gif","T3 flat in rua Ribeira das Vinhas, 1, Parque de Palmela - Ribeira das Vinhas, Cascais, Cascais e Estoril","1,350,000","T3","225 m²","3rd floor with lift","Apartment with 3 bedrooms, totally renovated, located in a very quiet area in the center of Cascais.
The apartment is composed by a hall, living room with fireplace with access to the terrace, dining room, kitchen, laundry room, 2 suites, 1 bedroom and 3 bathrooms.
Parking for 1 car in the garage.
Apartment with exc","",""
"","","","","https://st3.idealista.pt/38/c3/71/cbluxus.gif","Detached house in avenida da República, 1910, Alcoitão, Alcabideche","15,000,000","T8","706 m²","","This property is distinguished by its large areas, luminosity, comfort, contemporary design and quality.
The property sits on a plot of 4600m2, with the house having 706m2 of floor area. The contemporary, luxurious interiors stand out for their unique details, including white Volkata marble, Nicolazzi handcrafted taps","","Luxury"
"","","","","https://st3.idealista.pt/7e/77/29/imojoy-real-estate.gif","T2 flat in rua Casalinho da Ajuda, Rio Seco - Casalinho, Ajuda","250,000","T2","65 m²","1st floor","2 bedroom flat in a building without lift, located near the Palace, 550 meters from the Largo da Ajuda Garden, 700 meters from the Viewpoint Garden, 5 minutes walking distance from the University Campus, with various types of commerce, services and transport.
Main features:
65.10 m2
2 Bedrooms w/ balcony access","",""
"","","","","https://st3.idealista.pt/7e/77/29/imojoy-real-estate.gif","T1 flat in rua Valentim Henrique, Centro, Alcabideche","435,000","T1","61 m²","5th floor without lift","Very bright 1+1 bedroom flat, on the top floor of a 5-storey building, with unobstructed views, with a large terrace, parking for 1 car and storage room. Located in Quinta de São Martinho in Alcabideche-Cascais
Composed by:
Entrance hall with access to the attic
Living room with south sun exposure with access to the t","Parking included",""
"","","","","https://st3.idealista.pt/7e/b7/c7/carpe-domus.gif","House in rua do Murtal, 300, São Pedro do Estoril, Estoril, Cascais e Estoril","1,490,000","T5","585 m²","","5+3 bedroom villa of distinctive architecture on a plot of 900m2, in São Pedro do Estoril, Cascais.
3-storey villa with plenty of pay and surrounding garden.
The -1 floor consists of a bedroom, bathroom with shower, wine cellar, laundry room and two living rooms.
Floor 0 consists of entrance hall, bright living room","",""
"","","","","https://st3.idealista.pt/9d/97/a9/engel-voelkers-cascais-group.gif","Detached house in rua José Joaquim de Freitas, Parque de Palmela - Ribeira das Vinhas, Cascais, Cascais e Estoril","4,100,000","T6","518 m²","","Stunning 6-bedroom villa, located just a 6-minute walk from the center of Cascais where you can find magnificent restaurants with dazzling views, street commerce, services and a Hypermarket, is set on a plot of land measuring 1000m2, with a total construction area of 518m2 and a private gross area of 317m2.
This spacio","Parking included","Luxury"
"","","","","https://st3.idealista.pt/3c/71/3f/cbluxus-lisboa.gif","T3 flat, Praça Duque de Saldanha, 21, Saldanha - Picoas, São Jorge de Arroios, Arroios","2,390,000","T3","286 m²","with lift","Unique apartment in Saldanha, Lisbon, with 286 m2 of area, in a building with 1 apartment per floor, terrace and gym on the rooftop, luxury finishes, excellent sun exposure and balconies in all rooms.
The apartment is equipped with air conditioning, central heating, home automation, double glazing with thermal and acou","Parking included","Luxury"
"","","","","https://st3.idealista.pt/36/c9/19/rajani-team.gif","Palace in rua Doutor Alfredo da Costa, Nn, Centro de Sintra - Portela de Sintra , Sintra","2,190,000","T17","2,348 m²","","Identificação do imóvel: ZMPT557146
Sintra, Monte da Lua, is one of those places full of magic and mystery where nature and Man come together in such a perfect symbiosis that UNESCO has classified it as a World Heritage Site.
Discover the most recent mansion in the historic center of Sintra, with an approved tourism","Parking included",""
"","","","","https://st3.idealista.pt/7e/77/29/imojoy-real-estate.gif","Terraced house in rua Alfredo Pimenta, Bairro de Santa Cruz, Benfica","480,000","T3","94 m²","","Partially refurbished villa keeping some of the main original details and needing only some modernisation works in terms of kitchen and bathrooms.
Inserted in a plot of 105m2, this villa has 2 patios, in the front and rear and is distributed as follows:
Floor 0:
Living room and dining room with fireplace, guest bath","",""
"","","","","https://st3.idealista.pt/36/c9/19/rajani-team.gif","T4 flat in avenida Wenceslau Balseiro Guerra, 145, Carcavelos Centro, Carcavelos e Parede","1,350,000","T4","336 m²","5th floor with lift","Identificação do imóvel: ZMPT559173
This fully equipped T4 is located on the 5th floor of a recent building with a lift, next to the center of Carcavelos. The apartment located on the top floor has a total of 295 m2 between the apartment and the terrace.
The useful area of 195 m2 is divided as follows: hall with wardr","Parking included","Sea views"
"","","","","https://st3.idealista.pt/7e/77/29/imojoy-real-estate.gif","T2 flat in praceta da Quinta do Pomar de Cima, Alto da Mira - Moinhos da Funcheira - Carenque, Mina de Água","160,000","T2","58 m²","Ground floor without lift","This charming 2 bedroom flat on the ground floor, yet with plenty of light, offers the perfect setting for comfortable and convenient living. With recent refurbishment works, this space has been carefully designed to provide maximum comfort and safety for you and your family.
The flat is well located, situated in a cen","",""
"","","","","https://st3.idealista.pt/e5/8d/1a/engel-volkers-lisboa.gif","T4 flat in rua João de Freitas Branco, 33, Alto dos Moinhos, São Domingos de Benfica","930,000","T4","220 m²","with lift","Fabulous T4 Duplex with mezzanine measuring approximately 193m2 in the heart of Alto dos Moinhos
Apartment from 2003, very well maintained, very spacious and with southern sun exposure, which gives it lots of light, has a very interesting L-shaped layout.
On the lower floor we find on the right a corridor with a huge","",""
"","","","","https://st3.idealista.pt/36/c9/19/rajani-team.gif","T5 flat in avenida Bartolomeu Dias, 11, Infantado, Loures","950,000","T5","178 m²","8th floor with lift","Identificação do imóvel: ZMPT555688
If you are looking for a luxury property with high-quality finishes, located in a central area near Lisbon, this 4-bedroom, 2-suite duplex apartment in the noble neighborhood of Infantado in Loures is the perfect choice for you.
The property has a gross area of 178m², with 154m² of","Parking included",""
"","","","","https://st3.idealista.pt/df/38/ca/5star-properties.gif","Semi-detached house in rua das Tomadas, Malveira da Serra, Alcabideche","1,690,000","T5","298 m²","","Luxury Villa with Sea View, located in the area of Malveira da Serra, a very quiet area between the mountains of Sintra and the sea.
This contemporary 5 bedroom villa has sea views from all balconies and terraces, as well as the living room and pool.
With an area of 238m2 and excellent West/South exposure, the villa","Parking included","Sea views"
"","","","","https://st3.idealista.pt/9d/5b/35/habisale-sociedade-de-medicao-imobiliaria.gif","T3 flat in rua Augusto Gil, Centro, Odivelas","378,000","T3","134 m²","3rd floor with lift","Exclusive Property Habisale
3 bedroom apartment (2 bedroom + 1) located in the center of Odivelas, next to Colinas do Cruzeiro.
It is very well served by local shops, public services, schools, green spaces and transport (including bus access to Odivelas Metro Station).
Close to the main access routes to Lisbon (CRIL","",""
"","","","","https://st3.idealista.pt/42/99/e8/pvhouse.gif","T3 flat in rua António Nobre, 11, Estrada de Benfica, São Domingos de Benfica","429,900","T3","115 m²","2nd floor without lift","Beautiful 3 bedroom flat Refurbished with Mezzannine!
Apartment COMPLETELY REFURBISHED to DEBUT, located in São Domingos de Benfica, with two solar fronts, it is a 2nd floor, inserted in a building recovered in its entirety!
Consisting of:
- Kitchen and living room in Open Space;
- Full bathroom;
- 1 suite with dress","",""
"","","","","https://st3.idealista.pt/36/c9/19/rajani-team.gif","T3 flat in rua Doutor Almeida Amaral, Nn, Campo de Santana - Santa Marta, Santo António","1,950,000","T3","160 m²","Ground floor without lift","Identificação do imóvel: ZMPT563193
Welcome to your new home! In this house you will find sophistication, contemporary design and a privileged location. This stunning luxury T3 loft, located just 5 minutes from the prestigious Avenida da Liberdade, offers an exclusive lifestyle in the heart of Lisbon.
Main Features:","",""
"","","","","https://st3.idealista.pt/7e/ba/d5/hb-luxury-real-estate.gif","Semi-detached house in Centro da Vila, Ericeira","730,000","T3","228 m²","","Come and discover with HB Luxury Real Estate this new 3-bedroom townhouse with contemporary architecture on two floors on a plot of 245m2 and with a fantastic view over the sea of Ericeira.
With a perfect distribution, on Floor 0 a Hall gives access to a Living and Dining Room with covered terrace and direct access to","","Sea views"
"","","","","https://st3.idealista.pt/e5/8d/1a/engel-volkers-lisboa.gif","T3 flat in rua Gonçalves Crespo, 27, Estefânia, São Jorge de Arroios, Arroios","395,000","T3","119 m²","2nd floor","Excellent apartment completely renovated, with a very functional layout.
It consists of a suite and 2 bedrooms. The kitchen is fully equipped, has a contemporary and modern design, and ends on a balcony with good light. It also has a very large lounge with three distinct areas: dining room, living room and sunroom. Th","",""
"","","","","https://st3.idealista.pt/3f/db/f3/city-odivelas.gif","T2 flat in praceta Ivone Silva, Nn, Póvoa de Santa Iria e Forte da Casa, Vila Franca de Xira","279,800","T2","132 m²","6th floor with lift","From my balcony I see the Vasco da Gama Bridge!
Yes, this could be your dream apartment.
Large and modern apartment, with 132 m2 of gross area, in excellent condition, with two fronts, three balconies, two bathrooms and a box garage. In a building with two elevators and an outdoor patio.
With plenty of natural light,","Parking included",""
"","","","","https://st3.idealista.pt/42/99/e8/pvhouse.gif","T2 flat in rua Cândido dos Reis, 31, Centro - Parque Central, Mina de Água","215,000","T2","98 m²","Basement without lift","","",""
"","","","","https://st3.idealista.pt/9d/5b/35/habisale-sociedade-de-medicao-imobiliaria.gif","T1 flat in rua Natália Correia, 279, Murtal - Madorna, Carcavelos e Parede","278,000","T1","90 m²","","1 bedroom duplex flat with access to the basement that has been converted into a suite. Excellent location in Murtal in a building with three floors and no lift. It is a high ground floor with storage room. The kitchen was renovated as well as the main bathroom five years ago, with replacement of the plumbing. The livi","",""
"","","","","https://st3.idealista.pt/7e/77/29/imojoy-real-estate.gif","T3 flat in rua Luís de Sttau Monteiro, Outurela - Portela, Carnaxide e Queijas","535,000","T3","129 m²","3rd floor with lift","Excellent 3 bedroom flat (4 rooms) with a private area of 130m2 in very good condition with quality construction with plenty of natural light (East / South / West). Inserted in a quiet residential area of Carnaxide, Portela 10 minutes from Lisbon.
The flat consists of:
Large entrance hall
Equipped kitchen 15m2 with ind","Parking included",""
"","","","","https://st3.idealista.pt/36/c9/19/rajani-team.gif","Detached house in rua Tomás Vieira da Cruz, 20, Serra de Carnaxide - Parque de Santa Cruz, Carnaxide e Queijas","2,899,000","T5","405 m²","","Identificação do imóvel: ZMPT565207
Adjacent to one of the main central areas of the capital, this luxurious villa is born with a set of characteristics that undoubtedly define it as the most categorised residential offer in the entire Carnaxide region.
With a design of excellence and modern architecture conceived by","Parking included","Luxury"
"","","","","https://st3.idealista.pt/7e/77/29/imojoy-real-estate.gif","T1 flat in rua do Vale Formoso, Marvila, Lisboa","169,000","T1","30 m²","Ground floor without lift","Completely refurbished with a gross private area of 40 m2.
Located in Marvila, on Rua Vale Formosos and inserted in a typical Lisbon patio.
Composed by:
Living and Dining Room;
Bedroom with Closet and Full Bathroom;
Fully equipped kitchen, (Extractor Fan, Hob, Oven, Water Heater, Microwave, Dishwasher, Washing Machin","",""
"","","","","https://st3.idealista.pt/12/a1/ff/atlantic.gif","T1 flat in rua do Minho, 107, Centro do Estoril, Estoril, Cascais e Estoril","259,000","T1","72 m²","1st floor with lift","1 Bedroom Apartment in Monte Estoril with Garage
Quiet and Family Friendly Environment: Located in a quiet and family-friendly area, the apartment offers a serene retreat while remaining conveniently close to everything.
Investment Opportunity: If you are looking to add real estate to your portfolio, this apartment i","Parking included",""
"","","","","https://st3.idealista.pt/36/c9/19/rajani-team.gif","Detached house in rua Pedro Nunes, Nn, Ramada e Caneças, Odivelas","699,800","T5","274 m²","","Identificação do imóvel: ZMPT564309
A true haven of tranquillity and sophistication characterizes this property that redefines standards of excellence.
On entering the first floor, you will be greeted by a generous living room, ideal for socializing with family and friends.
The fully-equipped kitchen with Bosch appl","Parking included",""
"","","","","https://st3.idealista.pt/e5/8d/1a/engel-volkers-lisboa.gif","T4 flat in Alto dos Moinhos, São Domingos de Benfica","375,000","T4","168 m²","","Excellent investment opportunity.
3+1 bedroom duplex apartment to be remodelled to your taste in an excellent location.
With a gross floor area of 168 sqm, it comprises an open-plan kitchen with dining area, dining room, double living room, 3 bedrooms and 2 bathrooms.
The flat is located next to Sete Rios and Praça d","",""
"","","","","https://st3.idealista.pt/73/d6/9a/eravilafrancadexira.gif","Detached house in rua Cidade de Portimão, Pontinha e Famões, Odivelas","940,000","T4","238 m²","","NEW 4+1 bedroom villa in a highly developed area, calm and with panoramic views of the city of Lisbon.
High quality finishes that give it a touch of refinement and each space, consists of 3 bedrooms with suites and closets, 1 bedroom with built-in wardrobes and an office / bedroom in the basement. Fully equipped kitch","Parking included",""
"","","","","https://st3.idealista.pt/4b/a8/3a/afinest.gif","Semi-detached house in rua Pimenteiras, Quinta da Marinha, Cascais, Cascais e Estoril","950,000","T2","168 m²","","ARE YOU LOOKING FOR A VILLA IN ONE OF THE MOST PRESTIGIOUS PLACES IN CASCAIS - QUINTA DA MARINHA?
Fully refurbished villa in 2019, 1 bedroom villa currently with 2 bedrooms, 2 full bathrooms, fully refurbished, fireplace, air conditioning, heated swimming pool, fully equipped kitchen BOSH and MIELE
BOSH Combo
BOSH Wa","",""
"","","","","","","","","","","","",""
"","","","","https://st3.idealista.pt/77/7d/1c/draft-in-homes.gif","Detached house in travessa Bento de Jesus Caraça, 2, Aldeia de Juzo - Charneca, Cascais, Cascais e Estoril","1,390,000","T3","253 m²","","5-room villa in Aldeia de Juso
5-bedroom villa with parking, garden and private pool, in Aldeia de Juso, Cascais.
Fantastic 4-bedroom villa with a gross private area of 253m2, set in the quiet area of Aldeia de Juso.
This property is located in one of the most sought-after areas of Cascais, and is completely finishe","",""
"","","","","https://st3.idealista.pt/4b/f5/86/remax-yes.gif","T1 flat in rua das Taipas, Praça da Alegria, Santo António","360,000","T1","62 m²","Basement with lift","Located in the prestigious Príncipe Real neighborhood, I present to you this 1-bedroom apartment in a building completely renovated in 2005, maintaining its original charm and adding comfort details such as the inclusion of an elevator. It is located just a 5-minute walk from Chiado, a 7-minute walk from the Tagus Rive","",""
