"pro src","item-gallery src","item-gallery src 2","map-content src","logo-branding src","item-link","item-price","item-detail","item-detail 2","item-detail 3","ellipsis","item-parking","listing-tags"
"","","","","https://st3.idealista.pt/e1/c4/49/infante-riu.gif","T2 flat in Largo do Rato - Estrela, Campo de Ourique","690,000","T2","104 m²","1st floor","2-bedroom duplex apartment for sale in São Bento, with an excellent location in the heart of Lisbon, between Assembleia da República and Largo do Rato.
Set in a century-old building, completely renovated in 2012, the apartment is spread over two floors. The entrance floor comprises a large living-dining room with two","",""
"","","","","https://st3.idealista.pt/ed/c2/fc/porta-da-frente-christies-international-real-estate.gif","T3 flat in Expo Central, Parque das Nações","1,200,000","T3","147 m²","with lift","If you are looking for an exclusive investment, this is your invitation to acquire a truly unique property in the heart of Lisbon. This 3 bedroom apartment is situated in the renowned Martinhal Residences, where refinement and comfort reach the highest level of quality. This is a rare and exclusive opportunity for a go","",""
"","","","","https://st3.idealista.pt/e5/8d/1a/engel-volkers-lisboa.gif","T4 flat in Fonte Nova - Calhariz, Benfica","840,000","T4","185 m²","5th floor with lift","Bright & sunny 4+1 room apartment, fully refurbished with 176 sqm. Located on the 5th floor of a prestigious building with elevators, close to the Fonte Nova Shopping Center in Benfica, near the Monsanto Forest Park.
The apartment is composed of a living room with 70 sqm, fully equipped kitchen with Bosch appliances, a","",""
"","","","","https://st3.idealista.pt/5a/4d/47/sosothebys-oeiras.gif","Detached house in Centro - Santo Amaro, Oeiras e São Julião da Barra - Paço de Arcos - Caxias","3,700,000","T11","1,332 m²","","Portugal Sotheby's Realty is pleased to present Chalet Isabela, located by the sea in the center of Santo Amaro de Oeiras. The property, with a construction area of 1332 m2, facing west/south, consists of two plots of land totaling 1,026m2. On these plots stands the fabulous centennial villa, once a grand family summer","Parking included",""
"","","","","https://st3.idealista.pt/2c/85/d7/century21village.gif","Detached house in rua Hortênsias, 50, Areia - Birre, Cascais, Cascais e Estoril","1,650,000","T6","300 m²","","5 BDR Art Deco Villa with a renovation project in Birre in 870m2 of land. With 300 square meters, the house surrounds the interior courtyard, which guarantees plenty of natural light and excellent circulation.
Ground Floor:
High ceiling entrance Hall, dining room, living room with direct access to the pool, large kit","Parking included","Approved project"
"","","","","https://st3.idealista.pt/4b/a8/3a/afinest.gif","Detached house in Beloura - Penha Longa, Sintra","1,325,000","T3","202 m²","","ARE YOU LOOKING FOR A REFURBISHED 3 BEDROOM VILLA WITH POOL AND GARDEN, IN QUINTA DA BELOURA?
Look no further. Found!
Recently refurbished villa with 202m2 of area on a plot of land of 437m2
On floor 0 you have:
Fully equipped kitchen 14m2 and with access to the outside, dining room and living room (44m2 total) with","",""
"","","","","","","","","","","","",""
"","","","","https://st3.idealista.pt/e5/8d/1a/engel-volkers-lisboa.gif","T1 flat in Centro de Carnaxide, Carnaxide e Queijas","249,000","T1","88 m²","","One bedroom apartment, located on the ground floor and inserted in building without elevator totally refurbished in 2022. This property is letted and has a balcony and a private outdoor space facing south. Located in the historic center of Carnaxide, this property benefits from the proximity of local commerce, restaura","",""
"","","","","https://st3.idealista.pt/df/9a/70/sothebys-cascais.gif","T4 flat in Bairro do Rosário, Cascais, Cascais e Estoril","890,000","T4","162 m²","3rd floor with lift","In the heart of Cascais, this spacious 4-bedroom flat offers a unique living experience. Located on the 3rd floor, this renovated property has 3 bathrooms and a charming 5.8 square metre balcony, perfect for enjoying unobstructed views and relaxing outdoors. With a gross private area of 126.8 square metres and a gross","Parking included",""
"","","","","https://st3.idealista.pt/e5/8d/1a/engel-volkers-lisboa.gif","Penthouse in Anjos, Arroios","525,000","T3","120 m²","","If you are looking for a unique, modern and spacious property, this flat is for you.
With 120 m², 3 bedrooms (one of them on the mezzanine), 2 bathrooms (one social), this penthouse offers you the comfort and quality of a unique property. The large, panoramic windows allow you to enjoy breathtaking views over the city","",""
"","","","","https://st3.idealista.pt/20/d4/9c/john-taylor.gif","T3 flat, Calçada da Tapada, Alto de Santo Amaro, Alcântara","995,000","T3","155 m²","4th floor with lift","3 bedrooms | 155m2 | light | charm | beautiful view | terrace | elevator | parking | Alcantara, Alto de Santo Amaro | Lisbon
Duplex apartment with an excellent location, only a few meters away from Pestana Palace Hotel, a trendy neighborhood overlooking the vineyards, in a completely renovated building with lots of ch","",""
"","","","","https://st3.idealista.pt/e5/8d/1a/engel-volkers-lisboa.gif","T0 flat in São Vicente de Fora, São Vicente","299,900","T0","38 m²","","Apartment completely renovated in S. Vicente, in Open Space with 38.5 sqm.
The kitchen has white furniture, tiles along the entire wall behind the furniture and is fully equipped with an oven, hob, extractor hood, microwave, built-in dishwasher, built-in washing machine, water heater and built-in fridge freezer. WC wit","",""
"","","","","https://st3.idealista.pt/e3/53/86/ins-portugal.gif","T4 flat in Centro, Campo de Ourique","650,000","T4","113 m²","","4 bedroom flat for sale in the centre of Campo de Ourique, in Lisbon, close to Amoreiras, universities, French lycée and renowned schools, metro, public transport, green spaces, children's play areas and all kinds of commerce. The property is located in an old building with a ceiling height of approximately 3.4m, consi","",""
"","","","","https://st3.idealista.pt/e5/8d/1a/engel-volkers-lisboa.gif","T2 flat in Príncipe Real - São Bento, Misericórdia","570,000","T2","74 m²","","Apartment with a total area of 74sqm, comprising entrance hall with built-in wardrobes, 2 bedrooms with 10sqm each, one of which has direct access to a pleasant balcony and there is also a complete bathroom measuring 4.60sqm. The 9.45sqm kitchen is fully equipped with a window facing the garden areas. The social area c","",""
"","","","","https://st3.idealista.pt/35/3e/25/century21-rise-and-shine.gif","T1 flat in rua Dias Neiva, Torres Vedras e Matacães, Torres Vedras","350,000","T1","190 m²","Ground floor without lift","Excellent 1+2 bedroom apartment in the heart of the historic center of Torres Vedras, completely renovated with modern high-end finishes.
A perfect option for those looking to enjoy a practical and very comfortable lifestyle.
Some details:
- Ground floor apartment with direct access to a small square
- Street without","",""
"","","","","https://st3.idealista.pt/e5/8d/1a/engel-volkers-lisboa.gif","Duplex in Pedrouços, Belém","318,000","T1","83 m²","","1 Bedroom apartment plus 1 on the ground floor, in a building that has just been completed, comprising two floors and two apartments. This apartment has a fully equipped kitchen that converges with the open-plan living room, with a pleasant interior patio, making the flat very bright. Still on the same floor, there is","",""
"","","","","https://st3.idealista.pt/4b/a8/3a/afinest.gif","Duplex in avenida Estrangeiros, Monte Estoril, Estoril, Cascais e Estoril","1,380,000","T3","130 m²","2nd floor with lift","3 bedroom duplex flat with top finishes in Monte de Estoril with sea and Cascais Bay views.
Apartment inserted in a building with lift will consist of:
1st Floor - Hall 17m2 with wardrobe, Suite 19m2 with closet area and access to a balcony, 2 Bedrooms both with wardrobes with 10m2 and 12m2, w/c to support the bedroom","","Sea views"
"","","","","https://st3.idealista.pt/ed/c2/fc/porta-da-frente-christies-international-real-estate.gif","T4 flat in avenida Dinamarca, Centro do Estoril, Estoril, Cascais e Estoril","2,190,000","T4","181 m²","Ground floor with lift","Inspired by the values of our very being, Essence is an exclusive development designed to be enjoyed to the fullest with the ones we love the most.
Surrounded by unique and inspiring green areas, combined with a refined and elegant design of authorial architecture, Essence has the ability to make every day special, wit","","Luxury"
"","","","","https://st3.idealista.pt/b1/dc/e7/casa-no-minuto.gif","T2 flat in rua do Vale de Santo António, Santa Engrácia, São Vicente","399,900","T2","60 m²","1st floor without lift","2 bedroom apartment in São Vicente, Lisbon. Graça is a typical neighborhood of Lisbon, with all kinds of commerce, services and schools. Close to Largo da Graça, the Church of São Vicente, Campo de Santa Clara and the Panteão Nacional.
This apartment, with 60 sq m, inserted in a totally renovated building, is located","",""
"","","","","https://st3.idealista.pt/81/ef/9a/sattar-properties.gif","Penthouse in Alto de Santa Catarina, Algés - Linda-a-Velha - Cruz Quebrada - Dafundo","2,500,000","T4","481 m²","3rd floor with lift","Four bedroom apartment for sale with river views in a privileged private condominium.
Completely refurbished in May 2021 with excellent quality finishes and attention to every detail with excellent sun exposure, this penthouse is set in a private condominium on the doorstep of Lisbon with a privileged view over the Ta","Parking included","Sea views"
"","","","","https://st3.idealista.pt/e5/8d/1a/engel-volkers-lisboa.gif","T2 flat in Pena, Arroios","591,000","T2","115 m²","","Bright apartment with quality finishes, spread over two bedrooms with built-in wardrobes, one of which is en suite, a living room, fully equipped kitchen and a social bathroom.
Full of natural light and with a high ceiling that gives it a special charm, this apartment has a total area of 115 sqm.
Elevator and access ad","",""
"","","","","https://st3.idealista.pt/2a/7c/ed/home-tailors-business.gif","T2 flat in Centro da Vila, Ericeira","375,000","T2","62 m²","","2 bedroom flat with sea view in charming Ericeira!
This magnificent flat offers a stunning view of the Atlantic Ocean and is located in a quiet condominium.
Let's explore in detail the features of this property:
R/C:
Bedroom 1: A comfortable room, perfect for relaxing and resting, with an area of 12.70 m².
Bathroom","","Sea views"
"","","","","https://st3.idealista.pt/e5/8d/1a/engel-volkers-lisboa.gif","T2 flat in Anjos, Arroios","480,000","T2","144 m²","","Excellent apartment with high ceilings of 3.20 metres, refurbished and with classic tiled floors, preserving its current charm and comfort. Central heating, fitted kitchen and a marvellous 24m2 terrace where you can enjoy quality time with family or friends.
As you enter the flat, to the right are the bright bedrooms,","","Bright"
"","","","","https://st3.idealista.pt/e5/8d/1a/engel-volkers-lisboa.gif","T4 flat in Bairro Azul - Parque Eduardo VII, Avenidas Novas","550,000","T4","138 m²","","Excellent investment opportunity in one of the noblest areas of Lisbon, in Bairro Azul.
The apartment is next to El Corte Inglês and Gulbenkian Gardens, the neighborhood has a range of services that allow an excellent quality of life. In terms of access, it is close to the metro and the main highways in the country, t","",""
"","","","","https://st3.idealista.pt/e5/8d/1a/engel-volkers-lisboa.gif","T3 flat in Pena, Arroios","606,500","T3","150 m²","with lift","Bright apartment with quality finishes, spread over three bedrooms, one of which is en suite, a living room, fully equipped kitchen and a social bathroom. The apartment extends to the outside through the terrace with 27sqm, where you can enjoy the light of Lisbon.
This property has excellent sun exposure, air condition","",""
"","","","","https://st3.idealista.pt/e5/8d/1a/engel-volkers-lisboa.gif","T2 flat in Bairro Alto, Misericórdia","324,000","T2","63 m²","","Charming apartment in Bairro Alto comprising lounge, two bedrooms, bathroom and equipped kitchen.
Hardwood flooring, Pombaline cage in the closet of one of the bedrooms. Corner apartment, with 3 balconies, aluminum window frames and reinforced door.
Bairro Alto Palace is situated in Bairro Alto. Is one of the eldest a","",""
"","","","","https://st3.idealista.pt/e5/8d/1a/engel-volkers-lisboa.gif","T2 flat in Centro, Campolide","485,000","T2","87 m²","","A unique opportunity, new 2 bedroom apartment with a private garden that belongs to the apartment. Building completely recovered, located in the center of Campolide.
Apartment of 87m2 consists of 2 bedrooms, one with built-in wardrobe, 2 bathrooms, modern and fully equipped kitchen. It also has a living room that opens","",""
"","","","","https://st3.idealista.pt/b1/dc/e7/casa-no-minuto.gif","Terraced house in travessa de Rana, Parede, Carcavelos e Parede","1,050,000","T3","183 m²","","3 bedroom villa with garage and garden in Parede, Cascais. Located in a residential area, with all kinds of services and commerce, just a few minutes from the beaches of Parede and São Pedro do Estoril, Prime School International and Penedo Urban Park.
This villa, inserted in a plot of land of 143 m2, with a gross ar","Parking included","Sea views"
"","","","","https://st3.idealista.pt/8d/3c/8d/coldwellbankercity.gif","T3 flat, Praça da República, 2, Carcavelos Centro, Carcavelos e Parede","400,000","T3","114 m²","3rd floor without lift","This apartment is rented until August 2024, with a profitability of 5.25%. After that date, you can live in it, keep the lease or start a new one.
It has 3 spacious bedrooms, 2 bathrooms, a large living room and a kitchen with good areas, fully equipped, with sunroom and storage. It is on a 3rd floor without elevator","",""
"","","","","https://st3.idealista.pt/1a/b3/87/maisconsultores-capital.gif","House in praceta Comendadeiras, Pontinha e Famões, Odivelas","690,000","T4","208 m²","","4 bedroom detached house with swimming pool in Casal do Bispo, Famões.
Excellent 4-bedroom detached villa with swimming pool in Casal do Bispo/Casal Novo, Famões. Drawer plot with 285 m2 and a useful area of 207 m2. House under construction, expected to be finished by the end of November 2023.
Floor 0 - 90m2 Large li","Parking included",""
"","","","","https://st3.idealista.pt/e5/8d/1a/engel-volkers-lisboa.gif","T1 flat in Centro de Carnaxide, Carnaxide e Queijas","290,000","T1","70 m²","","One bedroom apartment, located on the second floor and inserted in building without elevator totally refurbished in 2022. This property has a terrace facing south. Located in the historic center of Carnaxide, this property benefits from the proximity of local commerce, restaurants and public transport.
Carnaxide is one","",""
"","","","","https://st3.idealista.pt/81/ef/9a/sattar-properties.gif","T1 flat in Av. da Liberdade - Marquês de Pombal, Santo António","849,000","T1","71 m²","4th floor with lift","Fabulous 1-bedroom flat for sale in the center of Lisbon on the capital's most popular avenue, Avenida da Liberdade, located in a building completely renovated in 2022.
The flat has luxury finishes that can be seen in every detail and a home automation system.
The open space concept, which integrates the living room","",""
"","","","","https://st3.idealista.pt/e5/8d/1a/engel-volkers-lisboa.gif","T3 flat in Laranjeiras, São Domingos de Benfica","429,900","T3","72 m²","","2+1 bedroom flat with 22 sqm mezzanine in São Domingos de Benfica
Includes Home Staging
Kitchen + lounge with 25 sqm. The kitchen has white units; tiles on the entire wall behind the units; oven, hob, extractor fan, built-in dishwasher, built-in washing machine, built-in Thermo Accumulator and Combined; full bathroom w","",""
"","","","","https://st3.idealista.pt/e5/8d/1a/engel-volkers-lisboa.gif","T1 flat in São Sebastião da Pedreira, Avenidas Novas","550,000","T1","108 m²","with lift","Spacious 1 bedroom flat in Avenidas Novas, in one of the noblest areas of Lisbon.
This 81 sqm flat consists of a large living and dining room, bedroom with dressing room and full bathroom, fully equipped kitchen with Dietricht appliances, laundry area and two balconies which gives this flat a lot of space and comfort.","",""
"","","","","https://st3.idealista.pt/af/f6/75/casasruipedro.gif","T3 flat in rua Morais Soares, 34, Alto de São João - Alto do Varejão, Penha de França","219,500","T3","102 m²","2nd floor without lift","ATTENTION INVESTORS!
This property is located in a building in total ownership and 1/8 of the building is acquired, which the co-owners correspond to the 2nd Left. It is important to highlight that this property can only be purchased with equity and not using housing credit.
3 bedroom apartment full of charm, located","",""
"","","","","https://st3.idealista.pt/e5/8d/1a/engel-volkers-lisboa.gif","Duplex in Alfama - Sé, Santa Maria Maior","325,000","T1","55 m²","","Discover this charming one-bedroom duplex apartment in Alfama, just a few steps from the iconic Fado Museum.
With semi-new construction, 2019, inserted in a meticulously reconstructed building, fully furnished and equipped, ready to occupy immediately.
The living room and kitchen are spacious, the kitchen is well equip","",""
"","","","","https://st3.idealista.pt/20/d4/9c/john-taylor.gif","T3 flat in rua de Pedrouços, Pedrouços, Belém","1,950,000","T3","192 m²","1st floor with lift","Apartment T3 | 3 suites | Gross built area 191.6m2 | 2 parking spaces | Villa Garcia Condominium, Restelo
Apartment with 3 suites, in the exclusive Villa Garcia development in Restelo-Belém. Property from the end of the 18th century, the palace, now recovered, was for a period the residence of King João V and then o","Parking included",""
"","","","","","","","","","","","",""
"","","","","https://st3.idealista.pt/ab/4e/4f/alvarez-marinho.gif","T3 flat in Torres Vedras e Matacães, Torres Vedras","260,000","T3","100 m²","1st floor","Ref: 3084-T3UM
Offer Deed. (*)
OPPORTUNITY 3 bedroom flat in CENTRO TORRES VEDRAS, FULLY REHABILITATED.
Excellent location, building without lift, with all services close by, banks, schools, pharmacies, supermarkets, hospitals among other services.
Gross area - 100m2
Composed by:
Large living room, kitchen with lau","",""
"","","","","https://st3.idealista.pt/68/86/29/the-agency-portugal.gif","T4 flat in Centro, Belém","1,650,000","T4","281 m²","2nd floor without lift","Welcome to this unique duplex in Alcântara, which combines modern comfort and historic and traditional architecture.
Located in a well-structured building, this property hides a true jewel, a majestic tower with windows on all sides. This tower is the perfect place to relax and enjoy the picturesque views of the iconic","",""
"","","","","https://st3.idealista.pt/b0/f1/15/jll-residential-portugal.gif","Detached house in Areia - Birre, Cascais, Cascais e Estoril","2,350,000","T3","176 m²","","New 3 bedroom villa, gross floor area of 176 sqm, garden and private swimming pool, solar panels, set in the SandWoods luxury gated community, in Cascais, Lisbon.
The Sandwoods gated community is set on a landscaped area 88,000 sqm, with only 23,000 sqm dedicated to residential areas. The premium amenities include a co","Parking included",""
"","","","","https://st3.idealista.pt/ef/8e/ec/4473320332039114652-440171953.gif","Detached house in rua da Fonte Nova, Nn, Santa Iria de Azoia - São João da Talha - Bobadela, Loures","640,000","T4","307 m²","","Come and discover our villa located in a quiet area in the neighborhood of Fontaínhas de Baixo, Santa Iria de Azóia.
This spacious 3-storey residence (one of which is a garage) offers a welcoming and comfortable environment, perfect for families looking for a spacious home with lots of natural light. It has excellent","",""
"","","","","https://st3.idealista.pt/85/08/4c/rute-ferreira-unip-lda.gif","Detached house in Dois Portos e Runa, Torres Vedras","225,000","T3","205 m²","","Detached 5 bedroom villa, with land and closed garage
Discover the charm of this 5 bedroom villa in the town of Caixaria!
Kitchen renovated 5 years ago
Equipped with: hob, oven, water heater, refrigerator
It has a closed garage,
Outdoor land of 500m2, this property offers space and privacy for the whole family.
L","Parking included",""
"","","","","https://st3.idealista.pt/68/86/29/the-agency-portugal.gif","House in Penha Longa - Linhó - Atrozela, Alcabideche","1,950,000","T5","294 m²","","We present this fantastic 5-bedroom property in Atrozela, Cascais. A villa that has a useful area of 253 sqm on a plot of 1900 sqm, where we can find a swimming pool and two bungalows and unique features that transform it into a distinct, private, and exclusive property.
Built in 1988, it was renovated in 2009 with fi","Parking included",""
"","","","","https://st3.idealista.pt/68/86/29/the-agency-portugal.gif","T4 flat in Prazeres, Estrela","1,900,000","T4","271 m²","3rd floor with lift","Lapa is considered one of the most sought-after areas of Lisbon, offering an excellent quality of life, both for its quiet and charming atmosphere and for its proximity to commerce and the local community.
Located on top of one of the capital's seven hills, Lapa offers stunning views of the Tagus River, the 25th of Ap","Parking included",""
"","","","","https://st3.idealista.pt/c8/d8/f7/a-casa-das-casas.gif","House in Centro da Vila, Ericeira","1,200,000","T4","333 m²","","Charming semi-detached villa T4 with 3 suites, located next to the center of the village with sea view in a quiet area, easy access on foot to the center of the village, beaches and commerce.
Possibility to be converted into T6.
The villa is composed as follows:
- Floor 0 with hall, kitchen, office, bathroom, living","","Sea views"
"","","","","https://st3.idealista.pt/12/72/60/hakken-real-estate.gif","Detached house in Bicesse, Alcabideche","1,000,000","T3","256 m²","","New 3 bedroom villa, consisting of 3 floors in a quiet area of new villas and close to the access to the Estoril highway/tennis club.
It is a detached house on a plot of 300m2, with a patio that allows the parking of 3 cars, shelter for motorcycles and/or storage, and a large garden at the back with a swimming pool wi","",""
"","","","","","RE/MAX Yes","","","","","","",""
"","","","","https://st3.idealista.pt/68/86/29/the-agency-portugal.gif","T2 flat in Bicesse, Alcabideche","498,000","T2","126 m²","1st floor without lift","This bright and tastefully refurbished apartment features a spacious entrance hall and living room with a fireplace, two bedrooms, two bathrooms with fitted wardrobes, and a modern kitchen.
From the kitchen, you have direct access to the balcony, where you can enjoy a break or a meal overlooking the stunning Sintra hi","Parking included",""
"","","","","https://st3.idealista.pt/85/08/4c/rute-ferreira-unip-lda.gif","T3 flat in Torres Vedras e Matacães, Torres Vedras","260,000","T3","103 m²","1st floor without lift","- 3 bedroom apartment in the city center of Torres Vedras!
- Property has been completely renovated;
- 1st floor without elevator;
- Apartment with 03 bedrooms, one of which is a suite;
-01 Suite with wardrobe;
- Kitchen equipped with: hob, oven, extractor fan, water heater, dishwasher;
- 01 Balcony,
- 01 closed","",""
"","","","","https://st3.idealista.pt/c8/d8/f7/a-casa-das-casas.gif","House in Centro da Vila, Ericeira","1,070,000","T4","336 m²","1st floor","Magnificent single storey villa with a rustic design, completely refurbished with the best quality materials and equipment, on the edge of a village and very close to the sea. Comfort and tranquillity in an exclusive environment about 15 km from Ericeira
Detached, single-storey and rustic house, completely refurbished","","Bungalow"
"","","","","https://st3.idealista.pt/ab/4e/4f/alvarez-marinho.gif","House in Torres Vedras e Matacães, Torres Vedras","695,000","T4","270 m²","","Ref: 3142-V4UBM
4 bedroom villa with VIEW of TORRES VEDRAS, EXCELLENT CONDITION, 3 MINUTES FROM THE CENTER OF TORRES VEDRAS, with a plot of land 427m2, gross construction area 290m2, garage and barbecue, LOCATED IN THE BEST URBANIZATION OF TORRES VEDRAS.
House Painted 2 years ago, exterior painted with cork insulation","Parking included",""
"","","","","https://st3.idealista.pt/af/a8/83/lincerealestate.gif","Duplex in Príncipe Real - São Bento, Misericórdia","730,000","T3","136 m²","2nd floor","Located in the heart of Lisbon, in the picturesque neighbourhood of Rua de São Bento, this historic 3 bedroom duplex flat embodies the charm and light of the Portuguese capital. Inserted in a fully remodeled historic building, with a beautiful façade, it is distributed as follows:
Floor 0:
- Living room;
- Kitchen;
-","",""
"","","","","https://st3.idealista.pt/7e/ba/d5/hb-luxury-real-estate.gif","Terraced house in Várzea de Sintra, Sintra","695,000","T4","211 m²","","Come and discover with HB Luxury Real Estate this 3-bedroom villa transformed into a 4-bedroom villa, with garden, swimming pool and located in the village of Morelinho.
With a spacious area and an intelligent distribution of spaces, this residence was designed to provide a welcoming family life and memorable moments w","Parking included",""
